Título,Título Original,Año,Duración,Género,País,Puntuación Media,Número de Puntuaciones,Director,Reparto,Sinopsis,Enlace
Coco,Coco,2017,109,"Animación, Fantástico, Comedia, Drama",Estados Unidos,"8,0",53.934,"Lee Unkrich, Adrián Molina","Anthony Gonzalez, Gael García Bernal, Benjamin Bratt, Alanna Ubach, Renee Victor, Jaime Camil, Alfonso Arau","Miguel es un joven con el sueño de convertirse en leyenda de la música a pesar de la prohibición de su familia. Su ídolo es Ernesto de la Cruz, el músico y cantante más famoso de México. La pasión de Miguel le llevará a adentrarse en la ""Tierra de los Muertos"", donde conocerá su verdadero legado familiar. (FILMAFFINITY)",https://www.filmaffinity.com/es/film893369.html
Joker,Joker,2019,121,"Thriller, Drama",Estados Unidos,"8,0",70.870,Todd Phillips,"Joaquin Phoenix, Robert De Niro, Zazie Beetz, Frances Conroy, Brett Cullen, Bill Camp, Shea Whigham, Dante Pereira-Olson","Arthur Fleck (Phoenix) vive en Gotham con su madre, y su única motivación en la vida es hacer reír a la gente. Actúa haciendo de payaso en pequeños trabajos, pero tiene problemas mentales que hacen que la gente le vea como un bicho raro. Su gran sueño es actuar como cómico delante del público, pero una serie de trágicos acontecimientos le hará ir incrementando su ira contra una sociedad que le ignora. (FILMAFFINITY)",https://www.filmaffinity.com/es/film520214.html
Parásitos,Gisaengchung,2019,132,"Intriga, Comedia, Drama, Thriller",Corea del Sur,"8,0",61.739,Bong Joon-ho,"Song Kang-ho, Lee Sun-Kyun, Jang Hye-jin, Cho Yeo-jeong, Choi Woo-sik, Park So-dam, Park Seo-joon, Lee Jung-eun","Tanto Gi Taek (Song Kang-ho) como su familia están sin trabajo. Cuando su hijo mayor, Gi Woo (Choi Woo-sik), empieza a dar clases particulares en casa de Park (Lee Seon-gyun), las dos familias, que tienen mucho en común pese a pertenecer a dos mundos totalmente distintos, comienzan una interrelación de resultados imprevisibles. (FILMAFFINITY)",https://www.filmaffinity.com/es/film520465.html
Spider-Man: Cruzando el Multiverso,Spider-Man: Across the Spider-Verse,2023,140,"Animación, Acción, Aventuras, Ciencia ficción",Estados Unidos,"7,9",10.674,"Joaquim Dos Santos, Kemp Powers, Justin Thompson","Shameik Moore, Hailee Steinfeld, Brian Tyree Henry, Lauren Vélez, Jake Johnson, Oscar Isaac, Jason Schwartzman","Tras reencontrarse con Gwen Stacy, el amigable vecindario de Spider-Man de Brooklyn al completo es catapultado a través del Multiverso, donde se encuentra con un equipo de Spidermans encargados de proteger su propia existencia. Pero cuando los héroes se enfrentan sobre cómo manejar una nueva amenaza, Miles se encuentra enfrentado a las otras Arañas y debe redefinir lo que significa ser un héroe para poder salvar a la gente que más quiere. (FILMAFFINITY)",https://www.filmaffinity.com/es/film213653.html
Interstellar,Interstellar,2014,169,"Ciencia ficción, Drama, Aventuras",Estados Unidos,"7,9",102.357,Christopher Nolan,"Matthew McConaughey, Anne Hathaway, David Gyasi, Jessica Chastain, Mackenzie Foy, Matt Damon, Michael Caine, John Lithgow","Al ver que la vida en la Tierra está llegando a su fin, un grupo de exploradores dirigidos por el piloto Cooper (McConaughey) y la científica Amelia (Hathaway) emprende una misión que puede ser la más importante de la historia de la humanidad: viajar más allá de nuestra galaxia para descubrir algún planeta en otra que pueda garantizar el futuro de la raza humana. (FILMAFFINITY)",https://www.filmaffinity.com/es/film704416.html
Black Mirror: Blanca Navidad (TV),Black Mirror: White Christmas,2014,74,"Ciencia ficción, Drama",Reino Unido,"7,9",28.997,Carl Tibbetts,"Jon Hamm, Rafe Spall, Rasmus Hardiker, Oona Chaplin, Natalia Tena, Janet Montgomery, Ken Drury, Robin Weaver","Matt Trent (Jon Hamm) y Joe Potter (Rafe Spall) están pasando unos días en un lugar remoto en medio de un paraje asolado por la nieve. El día de Navidad, Matt prepara la tradicional comida navideña, mientras que la canción ""I Wish It Could Be Christmas Everyday"" suena por la radio. Entonces, un extraño impulso empuja a Matt a explicar a Joe la razón por la que descubrió el lugar remoto en el que se encuentran ahora, un tema que nunca habían discutido en los cinco años que llevan ahí. Aunque Joe tiene algunas dudas, Matt no titubea a la hora de exponer sus razones... Especial de ""Black Mirror"" donde tres historias provocadoras e inquietantes se entrelazan. (FILMAFFINITY)",https://www.filmaffinity.com/es/film992177.html
Cafarnaúm,Capharnaüm,2018,126,Drama,Líbano,"7,8",8.822,Nadine Labaki,"Zain Al Rafeea, Yordanos Shiferaw, Kawthar Al Haddad, Fadi Kamel Youssef, Cedra Izam, Boluwatife Treasure Bankole, Alaa Chouchnieh, Nour el Husseini","Ante un tribunal, Zain, un niño de 12 años, declara ante el juez. -¿Por qué has demandado a tus propios padres? -Por darme la vida.",https://www.filmaffinity.com/es/film867213.html
Whiplash,Whiplash,2014,103,Drama,Estados Unidos,"7,8",65.973,Damien Chazelle,"Miles Teller, J.K. Simmons, Melissa Benoist, Paul Reiser, Austin Stowell, Jayson Blair, Kavita Patil, Kofi Siriboe","El objetivo de Andrew Neiman (Miles Teller), un joven y ambicioso baterista de jazz, es triunfar en el elitista Conservatorio de Música de la Costa Este. Marcado por el fracaso de la carrera literaria de su padre, Andrew alberga sueños de grandeza. Terence Fletcher (J.K. Simmons), un profesor conocido tanto por su talento como por sus rigurosos métodos de enseñanza, dirige el mejor conjunto de jazz del Conservatorio. Cuando Fletcher elige a Andrew para formar parte del grupo, la vida del joven cambiará. (FILMAFFINITY)",https://www.filmaffinity.com/es/film206955.html
Del revés (Inside Out),Inside Out,2015,94,"Animación, Fantástico, Aventuras, Comedia",Estados Unidos,"7,8",81.576,"Pete Docter, Ronaldo Del Carmen","Amy Poehler, Phyllis Smith, Lewis Black, Bill Hader, Mindy Kaling, Kaitlyn Dias, Richard Kind","Riley es una chica que disfruta o padece toda clase de sentimientos. Aunque su vida ha estado marcada por la Alegría, también se ve afectada por otro tipo de emociones. Lo que Riley no entiende muy bien es por qué motivo tiene que existir la Tristeza en su vida. Una serie de acontecimientos hacen que Alegría y Tristeza se mezclen en una peligrosa aventura que dará un vuelco al mundo de Riley. (FILMAFFINITY)",https://www.filmaffinity.com/es/film135623.html
Your Name.,Kimi no Na wa. (Your Name.),2016,106,"Animación, Drama, Romance, Fantástico",Japón,"7,8",27.120,Makoto Shinkai,,"Taki y Mitsuha descubren un día que durante el sueño sus cuerpos se intercambian, y comienzan a comunicarse por medio de notas. A medida que consiguen superar torpemente un reto tras otro, se va creando entre los dos un vínculo que poco a poco se convierte en algo más romántico. (FILMAFFINITY)",https://www.filmaffinity.com/es/film307521.html
1917,1917,2019,119,"Bélico, Drama",Reino Unido,"7,7",50.029,Sam Mendes,"George MacKay, Dean-Charles Chapman, Mark Strong, Richard Madden, Benedict Cumberbatch, Colin Firth, Andrew Scott, Daniel Mays","En lo más crudo de la Primera Guerra Mundial, dos jóvenes soldados británicos, Schofield (George MacKay) y Blake (Dean-Charles Chapman) reciben una misión aparentemente imposible. En una carrera contrarreloj, deberán atravesar el territorio enemigo para entregar un mensaje que evitará un mortífero ataque contra cientos de soldados, entre ellos el propio hermano de Blake.",https://www.filmaffinity.com/es/film145446.html
El padre,The Father,2020,97,Drama,Reino Unido,"7,7",17.131,Florian Zeller,"Anthony Hopkins, Olivia Colman, Imogen Poots, Rufus Sewell, Olivia Williams, Mark Gatiss, Evie Wray, Ayesha Dharker","Anthony (Anthony Hopkins), un hombre de 80 años mordaz, algo travieso y que tercamente ha decidido vivir solo, rechaza todos y cada uno de las cuidadoras que su hija Anne (Olivia Colman) intenta contratar para que le ayuden en casa. Está desesperada porque ya no puede visitarle a diario y siente que la mente de su padre empieza a fallar y se desconecta cada vez más de la realidad. Anne sufre la paulatina pérdida de su padre a medida que la mente de éste se deteriora, pero también se aferra al derecho a vivir su propia vida. (FILMAFFINITY)",https://www.filmaffinity.com/es/film701512.html
Relatos salvajes,Relatos salvajes,2014,119,"Comedia, Drama",Argentina,"7,7",67.877,Damián Szifrón,"Ricardo Darín, Darío Grandinetti, Leonardo Sbaraglia, Érica Rivas, Oscar Martínez, Julieta Zylberberg, Rita Cortese, María Onetto","La película consta de seis episodios que alternan la intriga, la comedia y la violencia. Sus personajes se verán empujados hacia el abismo y hacia el innegable placer de perder el control, cruzando la delgada línea que separa la civilización de la barbarie. (FILMAFFINITY)",https://www.filmaffinity.com/es/film809035.html
La habitación,Room,2015,118,Drama,Irlanda,"7,7",46.134,Lenny Abrahamson,"Brie Larson, Jacob Tremblay, Joan Allen, William H. Macy, Megan Park, Amanda Brugel, Sean Bridgers, Joe Pingue","Para Jack, un niño de cinco años, la habitación es el mundo entero, el lugar donde nació, donde come, juega y aprende con su madre. Por la noche, mamá lo pone a dormir en el armario, por si viene el viejo Nick. La habitación es el hogar de Jack, mientras que para su madre es el cubículo donde lleva siete años encerrada, secuestrada desde los diecinueve años. Con gran tesón e ingenio, la joven ha creado en ese reducido espacio una vida para su hijo, y su amor por él es lo único que le permite soportar lo insoportable. Sin embargo, la curiosidad de Jack va en aumento, a la par que la desesperación de su madre, que sabe que la habitación no podrá contener ambas cosas por mucho más tiempo. (FILMAFFINITY)",https://www.filmaffinity.com/es/film741318.html
As bestas,As bestas,2022,137,"Thriller, Drama",España,"7,6",31.671,Rodrigo Sorogoyen,"Marina Foïs, Denis Ménochet, Luis Zahera, Diego Anido, Marie Colomb, Luisa Merelas, José Manuel Fernández y Blanco, Xavier Estévez","Antoine y Olga son una pareja francesa que se instaló hace tiempo en una aldea del interior de Galicia. Allí llevan una vida tranquila, aunque su convivencia con los lugareños no es tan idílica como desearían. Un conflicto con sus vecinos, los hermanos Anta, hará que la tensión crezca en la aldea hasta alcanzar un punto de no retorno.",https://www.filmaffinity.com/es/film227540.html
La doncella (The Handmaiden),Ah-ga-ssi (The Handmaiden),2016,145,"Thriller, Drama, Romance",Corea del Sur,"7,6",16.834,Park Chan-wook,"Kim Min-hee, Kim Tae-ri, Ha Jung-woo, Cho Jin-woong, Moon So-ri, Kim Hae-sook, Lee Yong-nyeo, Lee Dong-hwi, Yoo Min-chae","Corea, década de 1930, durante la colonización japonesa. La resuelta joven Sookee es contratada como criada de una rica mujer japonesa, Hideko, que vive recluida en una gran mansión bajo la influencia de su dominante tío. Pero Sookee está allí con un propósito secreto: ayudar a un estafador que se hace pasar por un conde japonés para seducir a Hideko y heredar después la fortuna de su tío. (FILMAFFINITY)",https://www.filmaffinity.com/es/film948449.html
Spider-Man: Un nuevo universo,Spider-Man: Into the Spider-Verse,2018,117,"Animación, Aventuras, Acción, Fantástico",Estados Unidos,"7,6",29.379,"Bob Persichetti, Peter Ramsey, Rodney Rothman","Shameik Moore, Jake Johnson, Hailee Steinfeld, Mahershala Ali, Brian Tyree Henry, Lily Tomlin, Lauren Vélez","En un universo paralelo donde Peter Parker ha muerto, un joven de secundaria llamado Miles Morales es el nuevo Spider-Man. Sin embargo, cuando el líder mafioso Wilson Fisk (a.k.a Kingpin) construye el ""Super Colisionador"" trae a una versión alternativa de Peter Parker que tratará de enseñarle a Miles como ser un mejor Spider-Man. Pero no será el único Spider Man en entrar a este universo, 4 versiones alternas de Spidey aparecerán y buscarán regresar a su universo antes de que toda la realidad colapse.",https://www.filmaffinity.com/es/film773389.html
Tres anuncios en las afueras,"Three Billboards Outside Ebbing, Missouri",2017,112,"Thriller, Drama",Reino Unido,"7,6",52.361,Martin McDonagh,"Frances McDormand, Woody Harrelson, Sam Rockwell, John Hawkes, Peter Dinklage, Caleb Landry Jones, Lucas Hedges, Abbie Cornish","Mildred Hayes (Frances McDormand), una mujer de 50 años cuya hija adolescente ha sido violada y asesinada, decide iniciar por su cuenta una guerra contra la Policía de su pueblo, Ebbing, al considerar que no hacen lo suficiente para resolver el caso y que se haga justicia. Su primer paso será contratar unas vallas publicitarias denunciando la situación y señalando al jefe de policía, William Willoughby (Woody Harrelson), como responsable principal de la pasividad policial. (FILMAFFINITY)",https://www.filmaffinity.com/es/film652266.html
Prisioneros,Prisoners,2013,153,"Thriller, Drama",Estados Unidos,"7,6",61.416,Denis Villeneuve,"Hugh Jackman, Jake Gyllenhaal, Viola Davis, Maria Bello, Terrence Howard, Melissa Leo, Paul Dano, David Dastmalchian","Keller Dover se enfrenta a la peor de las pesadillas: Anna, su hija de seis años, ha desaparecido con su amiga Joy y, a medida que pasa el tiempo, el pánico lo va dominando. Desesperado, decide ocuparse personalmente del asunto. Pero, ¿hasta dónde está dispuesto a llegar para averiguar el paradero de su hija?",https://www.filmaffinity.com/es/film276566.html
Oppenheimer,Oppenheimer,2023,180,"Drama, Thriller",Estados Unidos,"7,6",25.643,Christopher Nolan,"Cillian Murphy, Emily Blunt, Robert Downey Jr., Matt Damon, Josh Hartnett, Florence Pugh, Jason Clarke, Alden Ehrenreich","En tiempos de guerra, el brillante físico estadounidense Julius Robert Oppenheimer (Cillian Murphy), al frente del ""Proyecto Manhattan"", lidera los ensayos nucleares para construir la bomba atómica para su país. Impactado por su poder destructivo, Oppenheimer se cuestiona las consecuencias morales de su creación. Desde entonces y el resto de su vida, se opondría firmemente al uso de armas nucleares.",https://www.filmaffinity.com/es/film294474.html
Wolfwalkers,Wolfwalkers,2020,103,"Animación, Fantástico, Aventuras",Irlanda,"7,6",5.056,"Tomm Moore, Ross Stewart","Honor Kneafsey, Eva Whittaker, Sean Bean, Maria Doyle Kennedy, Simon McBurney, Tommy Tiernan","En una época en la que reinan la superstición y la magia, los lobos están considerados como una fuerza demoníaca que debe ser eliminada. Robyn es una joven aprendiz que viaja hasta Irlanda junto a su padre para erradicar al último grupo de lobeznos que conoce, pero la situación cambia cuando Robyn salva a Mebh. Su amistad la lleva a conocer el mundo de los denominados ""Wolfwalkers"", transformándose en aquello que su padre la ha mandado a destruir.",https://www.filmaffinity.com/es/film764468.html
Klaus,Klaus,2019,97,"Animación, Fantástico, Comedia, Drama",España,"7,6",17.904,Sergio Pablos,"Quim Gutiérrez, Luis Tosar, Belén Cuesta","Un cartero es enviado a una ciudad congelada en el norte, donde descubre que Papá Noel está escondido. A Jesper (voz de Quim Gutiérrez), el peor estudiante de la academia postal, le destinan a Smeerensburg, una gélida isla más allá del Círculo Polar Ártico, donde sus conflictivos habitantes apenas intercambian palabras y, mucho menos, cartas. Jesper está a punto de rendirse cuando encuentra una aliada, Alva (Belén Cuesta), la profesora del pueblo. También descubre a Klaus (Luis Tosar), un misterioso carpintero que vive aislado en una cabaña repleta de juguetes hechos a mano. Estas improbables amistades traerán la alegría de nuevo  a Smeerensburg, y crearán un nuevo legado de vecinos generosos, leyendas mágicas y calcetines colgados con cariño en las chimeneas.",https://www.filmaffinity.com/es/film148968.html
Green Book,Green Book,2018,130,"Drama, Comedia",Estados Unidos,"7,6",50.477,Peter Farrelly,"Viggo Mortensen, Mahershala Ali, Iqbal Theba, Linda Cardellini, Ricky Muse, David Kallaway, Montrel Miller, Harrison Stone","Año 1962. Tony Lip (Viggo Mortensen) es un rudo italoamericano del Bronx que es contratado como chófer del virtuoso pianista negro Don Shirley (Mahershala Ali). Ambos emprenderán un viaje para una gira de conciertos por el Sur de Estados Unidos, donde Tony deberá tener presente ""El libro verde"", una guía que indicaba los pocos establecimientos donde se aceptaba a los afroamericanos. Son dos personas que tendrán que hacer frente al racismo y los prejuicios, pero a las que el destino unirá, obligándoles a dejar de lado las diferencias para sobrevivir y prosperar en el viaje de sus vidas. (FILMAFFINITY)",https://www.filmaffinity.com/es/film710220.html
El cuento de la princesa Kaguya,Kaguya-hime no Monogatari,2013,137,"Animación, Fantástico, Drama",Japón,"7,6",9.210,Isao Takahata,,"Basada en un cuento popular japonés anónimo del siglo IX, ""El cortador de bambú"". La historia comienza cuando una pareja de ancianos campesinos encuentra a una niña diminuta dentro de una planta de bambú, y deciden adoptarla como si fuera su hija. Pasan los años, y rápidamente se convierte en una hermosa mujer pretendida por muchos hombres poderosos. (FILMAFFINITY)",https://www.filmaffinity.com/es/film931294.html
El lobo de Wall Street,The Wolf of Wall Street,2013,179,"Comedia, Drama",Estados Unidos,"7,6",103.294,Martin Scorsese,"Leonardo DiCaprio, Jonah Hill, Margot Robbie, Kyle Chandler, Cristin Milioti, Rob Reiner, Matthew McConaughey, P.J. Byrne","Película basada en hechos reales del corredor de bolsa neoyorquino Jordan Belfort (Leonardo DiCaprio). A mediados de los años 80, Belfort era un joven honrado que perseguía el sueño americano, pero pronto en la agencia de valores aprendió que lo más importante no era hacer ganar a sus clientes, sino ser ambicioso y ganar una buena comisión. Su enorme éxito y fortuna le valió el mote de “El lobo de Wall Street”. Dinero. Poder. Mujeres. Drogas. Las tentaciones abundaban y el temor a la ley era irrelevante. Jordan y su manada de lobos consideraban que la discreción era una cualidad anticuada; nunca se conformaban con lo que tenían. (FILMAFFINITY)",https://www.filmaffinity.com/es/film828416.html
La canción del mar,Song of the Sea,2014,90,"Animación, Aventuras, Fantástico, Infantil",Irlanda,"7,6",10.140,Tomm Moore,,"La historia del viaje a casa del último Niño Foca. Después de la desaparición de su madre, Ben y Saoirse son enviados a vivir con su abuela a la ciudad. Cuando deciden volver a su casa junto al mar, su viaje se convierte en una carrera contra el tiempo a medida que se internan en un mundo que Ben sólo conoce a través de las leyendas que le narraba su madre. Pero éste no es un cuento para dormir; estas criaturas llevan en nuestro mundo demasiado tiempo. Ben pronto se da cuenta de que Saoirse será la clave para su supervivencia. (FILMAFFINITY)",https://www.filmaffinity.com/es/film696917.html
Monstruo,Kaibutsu,2023,126,Drama,Japón,"7,5",1.367,Hirokazu Koreeda,"Soya Kurokawa, Hiiragi Hinata, Sakura Ando, Eita, Mitsuki Takahata, Akihiro Kakuta, Shido Nakamura, Yûko Tanaka","Cuando su joven hijo Minato empieza a comportarse de forma extraña, su madre siente que algo va mal. Al descubrir que el responsable de todo ello es un profesor, irrumpe en la escuela exigiendo saber qué está pasando. Pero a medida que la historia se desarrolla a través de los ojos de la madre, el profesor y el niño, la verdad va saliendo a la luz, poco a poco... (FILMAFFINITY)",https://www.filmaffinity.com/es/film700716.html
Vidas pasadas,Past Lives,2023,105,"Romance, Drama",Estados Unidos,"7,5",1.264,Celine Song,"Greta Lee, Yoo Teo, John Magaro, Jonica T. Gibbs, Isaac Cole Powell, Jane Yubin Kim, Kristen Sieh, Nathan Clarkson","Nora y Hae Sung, dos amigos de la infancia con una fuerte conexión, se separaron cuando la familia de Nora, que entonces tenía solo 10 años, emigró desde Corea del Sur a Canadá.  Muchos años después, cuando Nora está estudiando teatro en Nueva York, ambos se reencuentra con él online, y pasarán juntos una semana que les enfrentará al amor, al destino y a las elecciones que componen una vida.",https://www.filmaffinity.com/es/film450022.html
An Elephant Sitting Still,Da xiang xi di er zuo,2018,234,Drama,China,"7,5",1.735,Hu Bo,"Zhang Yu, Peng Yuchang, Wang Uvin, Li Congxi, He Miaomiao, Yanmanzi Zhu, Zhao Yanguozhang, Dong Xiangrong","Un día desde el amanecer hasta el anochecer, con varios personajes intentando tomar un tren para escapar de la espiral descendente en la que se encuentran. (FILMAFFINITY)",https://www.filmaffinity.com/es/film918355.html
Vengadores: Infinity War,Avengers: Infinity War,2018,156,"Ciencia ficción, Fantástico, Acción",Estados Unidos,"7,5",44.481,"Anthony Russo, Joe Russo","Robert Downey Jr., Chris Hemsworth, Benedict Cumberbatch, Chris Evans, Mark Ruffalo, Scarlett Johansson, Chris Pratt, Tom Holland","El todopoderoso Thanos ha despertado con la promesa de arrasar con todo a su paso, portando el Guantelete del Infinito, que le confiere un poder incalculable. Los únicos capaces de pararle los pies son los Vengadores y el resto de superhéroes de la galaxia, que deberán estar dispuestos a sacrificarlo todo por un bien mayor. Capitán América e Ironman deberán limar sus diferencias, Black Panther apoyará con sus tropas desde Wakanda, Thor y los Guardianes de la Galaxia e incluso Spider-Man se unirán antes de que los planes de devastación y ruina pongan fin al universo. ¿Serán capaces de frenar el avance del titán del caos? (FILMAFFINITY)",https://www.filmaffinity.com/es/film827414.html
Mandarinas,Mandariinid (Tangerines),2013,83,"Drama, Bélico",Estonia,"7,5",10.150,Zaza Urushadze,"Lembit Ulfsak, Giorgi Nakashidze, Misha Meskhi, Elmo Nüganen, Raivo Trass","En 1990, estalla la guerra en una provincia georgiana que busca la independencia. Ivo, un estonio, decide quedarse, a diferencia del resto de sus compatriotas, para ayudar a su amigo Margus con la cosecha de mandarinas. Al comenzar el conflicto, dos soldados resultan heridos delante de su casa, e Ivo se ve obligado a cuidar de ellos. (FILMAFFINITY)",https://www.filmaffinity.com/es/film894315.html
Dallas Buyers Club,Dallas Buyers Club,2013,117,Drama,Estados Unidos,"7,5",56.087,Jean-Marc Vallée,"Matthew McConaughey, Jennifer Garner, Jared Leto, Steve Zahn, Dallas Roberts, Denis O'Hare, Griffin Dunne, Kevin Rankin","Basada en la vida real de Ron Woodroof, un cowboy de rodeo texano, drogadicto y mujeriego, al que en 1986 le diagnosticaron SIDA y le pronosticaron un mes de vida. Empezó entonces a tomar AZT, el único medicamento disponible en aquella época para luchar contra tan terrible enfermedad. (FILMAFFINITY)",https://www.filmaffinity.com/es/film472295.html
La ciudad de las estrellas (La La Land),La La Land,2016,127,"Musical, Romance, Comedia, Drama",Estados Unidos,"7,5",59.162,Damien Chazelle,"Emma Stone, Ryan Gosling, John Legend, Rosemarie Dewitt, J.K. Simmons, Finn Wittrock, Sonoya Mizuno, Jessica Rothe","Mia (Emma Stone), una joven aspirante a actriz que trabaja como camarera mientras acude a castings, y Sebastian (Ryan Gosling), un pianista de jazz que se gana la vida tocando en sórdidos tugurios, se enamoran, pero su gran ambición por llegar a la cima en sus carreras artísticas amenaza con separarlos. (FILMAFFINITY)",https://www.filmaffinity.com/es/film689956.html
Her,Her,2013,126,"Ciencia ficción, Romance, Drama",Estados Unidos,"7,5",78.326,Spike Jonze,"Joaquin Phoenix, Amy Adams, Rooney Mara, Olivia Wilde, Chris Pratt, Portia Doubleday, Matt Letscher, Brian Johnson","En un futuro cercano, Theodore, un hombre solitario a punto de divorciarse que trabaja en una empresa como escritor de cartas para terceras personas, compra un día un nuevo sistema operativo basado en el modelo de Inteligencia Artificial, diseñado para satisfacer todas las necesidades del usuario. Para su sorpresa, se crea una relación romántica entre él y Samantha, la voz femenina de ese sistema operativo. (FILMAFFINITY)",https://www.filmaffinity.com/es/film889720.html
Close,Close,2022,104,Drama,Bélgica,"7,5",6.513,Lukas Dhont,"Eden Dambrine, Gustav De Waele, Émilie Dequenne, Léa Drucker, Igor van Dessel, Kevin Janssens, Marc Weiss","Léo y Rémi, de 13 años, son amigos de toda la vida. Hasta que un suceso impensable los separa. Léo se acerca entonces a Sophie, la madre de Rémi, para tratar de entender. (FILMAFFINITY)",https://www.filmaffinity.com/es/film297297.html
"Hasta siempre, hijo mío",Di jiu tian chang,2019,180,Drama,China,"7,5",2.572,Wang Xiaoshuai,"Ai Liya, Du Jiang, Zhao Yanguozhang, Li Jingjing, Qi Xi, Xu Cheng, Wang Jingchun, Roy Wang, Yong Mei","Liyun y Yaojun, una pareja de obreros, intenta recuperarse de una devastadora tragedia familiar en los tumultuosos años entre 1980 y el siglo XXI. Constreñidos por la política nacional de hijo único, sus vidas se transforman gradualmente por el impacto de la cambiante identidad nacional en China. (FILMAFFINITY)",https://www.filmaffinity.com/es/film916238.html
La gran belleza,La grande bellezza,2013,142,"Comedia, Drama",Italia,"7,4",37.461,Paolo Sorrentino,"Toni Servillo, Carlo Verdone, Sabrina Ferilli, Serena Grandi, Galatea Ranzi, Isabella Ferrari, Giulia Di Quilio, Luca Marinelli","En Roma, durante el verano, nobles decadentes, arribistas, políticos, criminales de altos vuelos, periodistas, actores, prelados, artistas e intelectuales tejen una trama de relaciones inconsistentes que se desarrollan en fastuosos palacios y villas. El centro de todas las reuniones es Jep Gambardella (Toni Servillo), un escritor de 65 años que  escribió un solo libro y practica el periodismo. Dominado por la indolencia y el hastío, asiste a este desfile de personajes poderosos pero insustanciales, huecos y deprimentes. (FILMAFFINITY)",https://www.filmaffinity.com/es/film202506.html
