Título,Título Original,Año,Duración,Género,País,Puntuación Media,Número de Puntuaciones,Director,Reparto,Sinopsis,Enlace
Los reyes del mundo,Los reyes del mundo,2022,111,Drama,Colombia,"6,6",1.789,Laura Mora Ortega,"Carlos Andrés Castañeda, Davison Florez, Cristian Campaña, Brahian Acevedo, Cristian David Duque, Violeta Zabala, Jacqueline Duque","“Un día todos los hombres se quedaron dormidos… Y los cercos de la tierra, ardieron”. Una historia sobre la desobediencia, la amistad y la dignidad que existe en la resistencia. Rá, Culebro, Sere, Winny y Nano. Cinco chicos de la calle de Medellín. Todos huérfanos. Cinco reyes sin reino, sin ley, sin familia, emprenden un viaje en búsqueda de la tierra prometida. Emprenden el camino para recuperar un pedacito de tierra que las autoridades han restituido a uno de ellos, después de que los paramilitares se la hubieran arrebatado, años atrás, a su abuela, ya fallecida. Un cuento subversivo a través de un clan salvaje y entrañable, que transita entre realidad y delirio. Un viaje hacia la nada, donde pasa todo.",https://www.filmaffinity.com/es/film975411.html
La mirada del hijo (Madre e hijo),Poziția copilului (Child's Pose),2013,112,Drama,Rumanía,"6,6",2.002,Calin Peter Netzer,"Luminita Gheorghiu, Bogdan Dumitrache, Florin Zamfirescu, Natasa Raab, Ilinca Goia, Adrian Titieni, Vlad Ivanov","Una noche, un hombre de 32 años, que conduce su coche a una velocidad muy superior a la establecida, atropella a un niño que muere poco después. Al temerario conductor le espera una pena de prisión de entre tres y quince años, pero su madre, una arquitecta de la clase alta de Rumanía, intentará evitarlo por todos los medios. (FILMAFFINITY)",https://www.filmaffinity.com/es/film423275.html
The Innocents,De uskyldige,2021,113,"Fantástico, Terror, Thriller",Noruega,"6,6",5.669,Eskil Vogt,"Rakel Lenora Fløttum, Sam Ashraf, Alva Brynsmo Ramstad, Kadra Yusuf, Ellen Dorrit Petersen, Morten Svartveit, Mina Yasmin Bremseth Asheim, Marius Kolbenstvedt","Durante las vacaciones de verano, la familia de Ida, de 9 años, se instala en un barrio de los suburbios de Oslo. Con su hermana, la niña trata de ajustarse a su nuevo entorno y se hace amiga de otros dos niños. Lejos de los adultos, los cuatro amigos descubren que poseen poderes sorprendentes, que incluyen inocentemente en sus juegos. Mientras exploran sus nuevos talentos en un bosque y un parque cercanos, su entretenimiento comienza a adquirir poco a poco tintes inquietantes y empiezan a ocurrir sucesos extraños. (FILMAFFINITY)",https://www.filmaffinity.com/es/film897184.html
El mayordomo,Lee Daniels' The Butler,2013,132,Drama,Estados Unidos,"6,6",25.715,Lee Daniels,"Forest Whitaker, Oprah Winfrey, David Oyelowo, Cuba Gooding Jr., John Cusack, Terrence Howard, Lenny Kravitz, James Marsden","Cecil Gaines (Forest Whitaker) fue mayordomo jefe de la Casa Blanca durante el mandato de ocho presidentes (1952-1986), lo que le permitió ser testigo directo de la historia política y racial de los Estados Unidos. (FILMAFFINITY)",https://www.filmaffinity.com/es/film647978.html
Blue Jean,Blue Jean,2022,97,Drama,Reino Unido,"6,6",1.105,Georgia Oakley,"Rosy McEwen, Kerrie Hayes, Lydia Page, Lucy Halliday, Stacy Abalogun, Deka Walmsley, Gavin Kitchen, Farrah Cave","En 1988, una profesora homosexual se ve enfrentada a un grave problema cuando una nueva estudiante amenaza con revelar su secreto. (FILMAFFINITY)",https://www.filmaffinity.com/es/film185176.html
Lobo,Theeb,2014,100,"Aventuras, Drama, Thriller",Jordania,"6,6",1.221,Naji Abu Nowar,"Jacir Eid, Hassan Mutlag, Hussein Salameh, Marji Audeh, Jack Fox","Arabia, 1916. Theeb -lobo en árabe- vive con su tribu beduina en un rincón olvidado del Imperio Otomano. Después de haber perdido recientemente a su padre, Hussein debe criar a su hermano Theeb. Sus vidas son interrumpidas con la llegada de un oficial del ejército británico y su guía en una misión misteriosa. Incapaz de negar su ayuda al británico por temor a deshonrar la reputación de su difunto padre, Hussein se compromete a acompañarles a su destino, un pozo de agua en la antigua ruta de peregrinación a La Meca. Temeroso de perder a su hermano, Theeb persigue a Hussein y se embarca en un peligroso viaje a través del desierto de Arabia que, desde el estallido de la Primera Guerra Mundial, se ha convertido en el coto de caza de mercenarios otomanos, revolucionarios árabes y asaltantes beduinos marginados. (FILMAFFINITY)",https://www.filmaffinity.com/es/film523944.html
Aguas tranquilas,Futatsume no mado (Still the Water),2014,110,Drama,Japón,"6,6",1.400,Naomi Kawase,"Nijiro Murakami, Jun Yoshinaga, Makiko Watanabe, Hideo Sakaki, Tetta Sugimoto, Miyuki Matsuda, Jun Murakami, Fujio Tokita","Los habitantes de la isla de Amami, viven en armonía con la naturaleza, están convencidos de que en cada árbol, cada piedra y cada planta vive un dios. Una tarde de verano, Kaito descubre el cuerpo de un hombre flotando en el mar. Su amiga Kyoko le ayudará a descifrar el misterio. Crecerán juntos, aprendiendo a ser adultos, descubriendo los ciclos de la vida, la muerte y el amor.  (FILMAFFINITY)",https://www.filmaffinity.com/es/film507577.html
Lean on Pete,Lean on Pete,2017,121,Drama,Reino Unido,"6,6",1.462,Andrew Haigh,"Charlie Plummer, Travis Fimmel, Steve Buscemi, Chloë Sevigny, Steve Zahn, Thomas Mann, Amy Seimetz, Justin Rain",Charlie Thompson es un chico de quince años que consigue un empleo de verano trabajando para un entrenador de caballos e inicia una amistad con un debilitado caballo de carreras.,https://www.filmaffinity.com/es/film935056.html
Amante por un día,L'amant d'un jour (Lover for a Day),2017,76,Drama,Francia,"6,6",1.678,Philippe Garrel,"Eric Caravaca, Esther Garrel, Louise Chevillotte, Paul Toucang, Félix Kysyl, Laetitia Spigarelli","Después de una ruptura, una chica de 23 años regresa a casa de su padre. Allí descubre que éste tiene una relación con una joven de su misma edad. (FILMAFFINITY)",https://www.filmaffinity.com/es/film448883.html
Palmer,Palmer,2021,110,Drama,Estados Unidos,"6,6",2.219,Fisher Stevens,"Justin Timberlake, Ryder Allen, Juno Temple, Alisha Wainwright, June Squibb, Dean Winters, Wynn Everett, Jesse C. Boyd","Tras doce años en prisión, Palmer, un ex jugador de fútbol, vuelve a casa para rehacer su vida. Mientras se adapta a su nueva realidad, entabla amistad con un niño abandonado, pero su pasado le persigue.",https://www.filmaffinity.com/es/film544668.html
Un gato callejero llamado Bob,A Street Cat Named Bob,2016,103,Drama,Reino Unido,"6,6",2.262,Roger Spottiswoode,"Luke Treadaway, Ruta Gedmintas, Joanne Froggatt, Anthony Head, Darren Evans, Tony Jayawardena, Adam Riches, Llewella Gideon","Un día James Bowen, un músico callejero de Londres, se encuentra en su apartamento un gato herido abandonado al que llama Bob. Basado en un bestseller del propio James Bowen (""A Street Cat Named Bob, and How he Saved my Life"") que estuvo en Inglaterra 52 semanas consecutivas en la lista de los más vendidos. (FILMAFFINITY)",https://www.filmaffinity.com/es/film360344.html
Brigsby Bear,Brigsby Bear,2017,97,"Comedia, Drama",Estados Unidos,"6,6",2.610,Dave McCary,"Kyle Mooney, Matt Walsh, Michaela Watkins, Ryan Simpkins, Greg Kinnear, Claire Danes, Mark Hamill, Jane Adams","'Brigsby Bear Adventures' es un programa de televisión infantil que tiene un solo espectador: James. Cuando el programa termina de golpe, la vida de James cambia para siempre, y éste se propone terminar la historia él mismo. (FILMAFFINITY)",https://www.filmaffinity.com/es/film724359.html
En un barrio de Nueva York,In the Heights,2021,143,"Musical, Romance, Drama, Comedia",Estados Unidos,"6,6",2.708,Jon M. Chu,"Anthony Ramos, Corey Hawkins, Melissa Barrera, Leslie Grace, Jimmy Smits, Gregory Diaz IV, Stephanie Beatriz, Daphne Rubin-Vega","Basado en el musical de Broadway, sigue a un grupo de vecinos del barrio Washington Heights, en Nueva York. El principal es Usnavi (Anthony Ramos), el simpático dueño de una bodega, criado por su abuela, que sueña con volver algún día a su República Dominicana de origen; la abuela Claudia, que desempeña el rol de abuela para muchos de los vecinos del barrio; Vanessa, de quien Usnavi está perdidamente enamorado; y Nina, una vieja amiga de Usnavi que regresa al barrio después de mucho tiempo, llevándole noticias inesperadas a sus padres, quienes han estado ahorrando toda la vida para darle una mejor educación académica de la que ellos tuvieron.",https://www.filmaffinity.com/es/film970588.html
Remember,Remember,2015,95,Drama,Canadá,"6,6",2.709,Atom Egoyan,"Christopher Plummer, Dean Norris, Martin Landau, Henry Czerny, Jürgen Prochnow, Bruno Ganz, Peter DaCunha, James Cade","Zev (Christopher Plummer) es un judío superviviente del Holocausto ya de 90 años y con alzheimer que busca a Rudy, un criminal de guerra nazi que fue responsable de la muerte de su familia, con el objetivo de asesinarlo. (FILMAFFINITY)",https://www.filmaffinity.com/es/film253783.html
‘71,‘71,2014,99,"Acción, Drama",Reino Unido,"6,6",8.484,Yann Demange,"Jack O'Connell, Paul Anderson, Valene Kane, Sean Harris, Barry Keoghan, Sam Reid, Charlie Murphy, Richard Dormer","Corre el año 1971, y la tensión social en Irlanda del Norte está escalando hacia una situación casi de guerra civil. Tras un motín y un enfrentamiento muy violento entre vecinos de un barrio y el ejército, un joven soldado británico con poca experiencia, Gary, se extravía en las peligrosas calles de Belfast, donde el conflicto del IRA está en plena ebullición, y donde patrullan unidades paramilitares y bandas radicales callejeras. (FILMAFFINITY)",https://www.filmaffinity.com/es/film902165.html
Loreak (Flores),Loreak,2014,99,Drama,España,"6,6",9.350,"Jon Garaño, José Mari Goenaga","Nagore Aranburu, Itziar Aizpuru, Itziar Ituño, Josean Bengoetxea, Ane Gabaraín, Egoitz Lasa, Jox Berasategui, Gotzon Sánchez, José Ramón Soroiz","La vida de Ane da un giro cuando semanalmente comienza a recibir de forma anónima un ramo de flores en su casa. Por su parte las vidas de Lourdes y Tere también se ven afectadas por unas misteriosas flores. Un desconocido deposita cada semana un ramo en memoria de alguien que fue importante en sus vidas. Esta es la historia de tres mujeres, tres vidas alteradas por la mera presencia de unas flores. Flores que harán brotar en ellas sentimientos que parecían olvidados… Pero al fin y al cabo, no son más que flores. (FILMAFFINITY)",https://www.filmaffinity.com/es/film810299.html
La reina de Katwe,Queen of Katwe,2016,124,Drama,Estados Unidos,"6,6",1.302,Mira Nair,"Lupita Nyong'o, David Oyelowo, Madina Nalwanga, Charity Rose Pimer, Ntare Mwine, Taryn Kyaze, Esther Tebandeke, Peter Odeke, Nikita Waligwa","Biopic de Phiona Mutesi, una joven ugandesa prodigio del ajedrez. Con 11 años ganó el campeonato juvenil de su país. Poco después pudo salir por primera vez de Uganda para ir a un torneo en Sudán. Y llegó a competir en la Olimpiada Mundial de la disciplina. (FILMAFFINITY)",https://www.filmaffinity.com/es/film604566.html
A Hard Day,Kkeut-kkaji ganda,2014,111,"Thriller, Drama, Acción",Corea del Sur,"6,6",1.606,Kim Seong-hoon,"Lee Sun-Kyun, Cho Jin-woong, Jeong Man-shik, Shin Jung-geun, Shin Dong-mi, Park Bo-gum, Dong-yeong Kim, Ju Seok-tae","Volviendo del entierro de su madre, el agente Gun-Su atropella a alguien. Aturdido, decide esconder el cadáver en la tumba de su madre. Los problemas, sin embargo, no quedan enterrados: uno de sus compañeros investiga a la víctima y un testigo no tardará en aparecer. (FILMAFFINITY)",https://www.filmaffinity.com/es/film460177.html
X+Y,X+Y,2014,111,Drama,Reino Unido,"6,6",1.824,Morgan Matthews,"Asa Butterfield, Rafe Spall, Sally Hawkins, Eddie Marsan, Jo Yang, Martin McCann, Jake Davies, Alex Lawther","En un mundo difícil de comprender, Nathan se esfuerza por conectar con los que le rodean -sobre todo con su madre-, pero lo cierto es que sólo encuentra verdadero consuelo en los números. Un día se encuentra con un profesor anárquico y poco convencional, el Sr. Humphreys, cuando Nathan se incorpora al equipo del Reino Unido para competir en las Olimpiadas Internacionales de matemáticas en Taipei. Ambos formarán una inusual y especial amistad. (FILMAFFINITY)",https://www.filmaffinity.com/es/film962307.html
Gracias a Dios,Grâce à Dieu,2018,137,Drama,Francia,"6,6",2.403,François Ozon,"Melvil Poupaud, Denis Ménochet, François Marthouret, Josiane Balasko, Eric Caravaca, Swann Arlaud, Hélène Vincent, Aurélia Petit","Alexandre vive en Lyon con su esposa e hijos. Por casualidad, se entera de que el sacerdote que abusó de él cuando era un boy scout sigue trabajando con niños. Se lanza a un combate al que se unen François y Emmanuel, otras víctimas del sacerdote, con el fin de liberarse de sus sufrimientos a través de la palabra. Pero las repercusiones y consecuencias de sus testimonios no dejarán a nadie indemne. Basada en el caso real de Bernard Preynat, sacerdote de la Diócesis de Lyon, acusado en 2016 de abusar sexualmente de decenas de niños. (FILMAFFINITY)",https://www.filmaffinity.com/es/film183835.html
Entre dos aguas,Entre dos aguas,2018,136,Drama,España,"6,6",2.764,Isaki Lacuesta,"Israel Gómez Romero, Francisco José Gómez Romero, Rocío Rendón, Yolanda Carmona, Lorrein Galea, Manuel González del Tanago","Isra y Cheíto son dos hermanos que han tomado caminos muy diferentes en la vida. Cuando Isra sale de la cárcel y Cheíto termina una larga misión enrolado en la Marina, ambos regresan a la Isla de San Fernando. El reencuentro de los hermanos renovará el recuerdo de la muerte violenta de su padre cuando eran niños; la necesidad de retomar sus vidas y reconciliarse con ellos mismos les unirá de nuevo. Doce años después de “La Leyenda del Tiempo”, Isaki Lacuesta vuelve a San Fernando.",https://www.filmaffinity.com/es/film716085.html
Broker,Broker,2022,129,Drama,Corea del Sur,"6,6",2.855,Hirokazu Koreeda,"Lee Ji-Eun, Song Kang-ho, Gang Dong-won, Bae Doona, Lee Joo-young, Bek Hyun-jin, Ryu Kyung-Soo, Kang Gil-woo","Una noche lluviosa una joven abandona a su bebé a las puertas de una iglesia. El recién nacido es recogido por dos hombres que se dedican a robar bebés abandonados para venderlos a padres dispuestos a pagar una tarifa. Cuando la joven regresa a la iglesia, arrepentida, descubre el negocio ilegal de ambos hombres y decide unirse a ellos para encontrar a los padres adoptivos más adecuados. En este inusual viaje por carretera, el destino de los que se crucen en la vida del niño cambiará radicalmente. (FILMAFFINITY)",https://www.filmaffinity.com/es/film893654.html
Salyut-7: Héroes en el espacio,Salyut-7,2017,119,"Aventuras, Drama",Rusia,"6,6",3.769,Klim Shipenko,"Vladimir Vdovichenkov, Pavel Derevyanko, Lyubov Novikova, Ilya Andryukov, Oksana Fandera, Vasiliy Ignatich, Vitali Khayev, Sergey Korenkov","Narra la historia de la recuperación de la estación espacial Salyut 7, llevada a cabo por dos cosmonautas rusos en 1985. (FILMAFFINITY)",https://www.filmaffinity.com/es/film470126.html
Los días que vendrán,Los días que vendrán,2019,94,"Drama, Romance",España,"6,6",4.157,Carlos Marqués-Marcet,"David Verdaguer, Maria Rodríguez Soto, Albert Prat, Sergi Torrecilla, Míriam Alamany, Xavier de Gispert, Lupe Verdaguer Rodríguez","Vir (30) y Lluís (32) hace solo un año que salen juntos, cuando descubren que están “embarazados”. Durante 9 meses, seguiremos la aventura de esta joven pareja barcelonesa, el giro enorme que dará su vida, sus miedos, alegrías, sus expectativas y las realidades que, durante su embarazo, crecen ante ellos, intentando aprender a ser tres cuando ni siquiera habían tenido tiempo de aprender a ser dos. Utilizando el embarazo real de la pareja de actores protagonistas, la película explora la dificultad de compartir con el otro la experiencia profundamente transformadora de este proceso.",https://www.filmaffinity.com/es/film205885.html
El monstruo marino,The Sea Beast,2022,115,"Animación, Aventuras, Fantástico",Estados Unidos,"6,6",5.308,Chris Williams,"Zaris-Angel Hator, Karl Urban, Jared Harris, Marianne Jean-Baptiste",Una niña intrépida y un famoso cazador de monstruos marinos unen sus fuerzas para encontrar a una poderosa bestia. (FILMAFFINITY),https://www.filmaffinity.com/es/film201801.html
Techo y comida,Techo y comida,2015,90,Drama,España,"6,6",5.621,Juan Miguel del Castillo,"Natalia de Molina, Mariana Cordero, Jaime López, Montse Torrent, Mercedes Hoyos, Gaspar Campuzano, Natalia Roig, Manuel Tallafé","Jerez de la Frontera, 2012. Rocío, una madre soltera y sin trabajo, no recibe ningún tipo de ayuda ni subsidio. Vive con a su hijo de ocho años en un piso cuyo alquiler no paga desde hace meses, de modo que el dueño la amenaza continuamente con echarla a la calle. Para hacer frente a los gastos de manutención y alquiler, realiza trabajos ocasionales mal pagados y vende en el top manta objetos encontrados. (FILMAFFINITY)",https://www.filmaffinity.com/es/film560429.html
Selma,Selma,2014,123,Drama,Estados Unidos,"6,6",7.918,Ava DuVernay,"David Oyelowo, Tom Wilkinson, Carmen Ejogo, Tim Roth, Giovanni Ribisi, Common, Oprah Winfrey, Lorraine Toussaint","Esta crónica sobre la lucha del político y activista Dr. Martin Luther King Jr. (David Oyelowo) en defensa de los derechos civiles se centra en la marcha desde Selma a Montgomery, Alabama, en 1965, que llevó al presidente Lyndon B. Johnson (Tom Wilkinson) a aprobar la ley sobre el derecho al voto de los ciudadanos negros. (FILMAFFINITY)",https://www.filmaffinity.com/es/film583944.html
Cómo entrenar a tu dragón 3,How To Train Your Dragon: The Hidden World,2019,104,"Animación, Aventuras, Comedia",Estados Unidos,"6,6",9.304,Dean DeBlois,"Jay Baruchel, America Ferrera, F. Murray Abraham, Cate Blanchett, Gerard Butler, Craig Ferguson, Jonah Hill","Lo que comenzó como la inesperada amistad entre un joven vikingo y un temible dragón Furia Nocturna se ha convertido en una épica trilogía que ha recorrido sus vidas. En esta nueva entrega, Hipo y Desdentao descubrirán finalmente su verdadero destino: para uno, gobernar Isla Mema junto a Astrid; para el otro, ser el líder de su especie. Pero, por el camino, deberán poner a prueba los lazos que los unen, plantando cara a la mayor amenaza que jamás hayan afrontado... y a la aparición de una Furia Nocturna hembra. (FILMAFFINITY)",https://www.filmaffinity.com/es/film735785.html
La ladrona de libros,The Book Thief,2013,131,Drama,Estados Unidos,"6,6",26.203,Brian Percival,"Sophie Nélisse, Geoffrey Rush, Emily Watson, Nico Liersch, Ben Schnetzer, Sandra Nedeleff, Hildegard Schroedter, Gotthard Lange","Narra la historia de una animosa y valerosa jovencita llamada Liesel, que transforma las vidas de todas las personas de su entorno cuando la envían a vivir con una familia de acogida en la Alemania de la II Guerra Mundial. Para Liesel, el poder de las palabras y de la imaginación se convierte en una forma de escapar de los tumultuosos eventos que la rodean, tanto a ella como a toda la gente que conoce y quiere. (FILMAFFINITY)",https://www.filmaffinity.com/es/film824161.html
Lady Bird,Lady Bird,2017,94,"Comedia, Drama",Estados Unidos,"6,6",26.826,Greta Gerwig,"Saoirse Ronan, Laurie Metcalf, Lucas Hedges, John Karna, Beanie Feldstein, Tracy Letts, Timothée Chalamet, Danielle Macdonald","Christine (Saoirse Ronan), que se hace llamar ""Lady Bird"", es una adolescente de Sacramento en su último año de instituto. La joven, con inclinaciones artísticas y que sueña con vivir en la costa Este, trata de ese modo encontrar su propio camino y definirse fuera de la sombra protectora de su madre (Laurie Metcalf). (FILMAFFINITY)",https://www.filmaffinity.com/es/film600146.html
Buscando a Dory,Finding Dory,2016,103,"Animación, Aventuras, Comedia",Estados Unidos,"6,6",29.488,"Andrew Stanton, Angus MacLane","Ellen DeGeneres, Albert Brooks, Ed O'Neill, Kaitlin Olson, Ty Burrell, Diane Keaton, Eugene Levy","Un año después de los acontecimientos narrados en ""Buscando a Nemo"", Dory vive  apaciblemente con Marlin y su hijo Nemo. Pero durante un viaje para ver cómo las mantarrayas migran de vuelta a casa, los problemas de memoria de Dory parecen desaparecer durante un segundo: recuerda que tiene una familia e inmediatamente decide emprender viaje para reencontrarse con sus padres, a los que perdió hace años. (FILMAFFINITY)",https://www.filmaffinity.com/es/film533699.html
El inmortal: Una película de Gomorra,L'immortale,2019,115,Thriller,Italia,"6,6",1.326,Marco D'Amore,"Marco D'Amore, Giuseppe Aiello, Salvatore D'Onofrio, Giovanni Vastarella, Marianna Robustelli, Martina Attanasio, Gennaro Di Colandrea, Nello Mascia","La historia de Ciro Di Marzio, uno de los protagonistas de la serie ""Gomorra"". Es 1980, la tierra tiembla, el edificio se derrumba y el único que sobrevive es un bebé recién nacido: se llama Ciro Di Marzio pero, a partir de ese día, todos lo llamarán 'el Inmortal'. Desde Nápoles en los años 80 hasta un pasado reciente, la película cuenta los orígenes y la formación de uno de los personajes más queridos de la aclamada serie sobre la camorra napolitana. Desde su infancia en la calle hasta el contrabando, desde los primeros robos hasta los muertos asesinados: todo para sobrevivir en un mundo donde la inmortalidad es básicamente una condena... Dirigida por el propio actor Marco D'Amore. (FILMAFFINITY)",https://www.filmaffinity.com/es/film903840.html
La caída del imperio americano,La Chute de l'empire américain,2018,128,"Comedia, Drama",Canadá,"6,6",2.335,Denys Arcand,"Alexandre Landry, Maripier Morin, Rémy Girard, Louis Morissette, Maxim Roy, Pierre Curzi, Vincent Leclerc, Yan England","Pierre-Paul, de 36 años, un intelectual y doctor en filosofía se ve obligado a trabajar como repartidor para tener un salario decente. Un día, mientras entrega un paquete, se topa con la escena de un robo a mano armada que ha salido mal con un resultado de dos muertos. Se encuentra con dos bolsas de deporte repletas de billetes. Pierre-Paul se enfrenta a un dilema: largarse con las manos vacías o coger el dinero y huir... Sucesora temática de las películas de Denys Arcand 'El declive del imperio americano' y 'Las invasiones bárbaras'. (FILMAFFINITY)",https://www.filmaffinity.com/es/film286882.html
Después de la tormenta,Umi yori mo mada fukaku,2016,117,Drama,Japón,"6,6",2.491,Hirokazu Koreeda,"Hiroshi Abe, Kirin Kiki, Yoko Maki, Lily Franky, Isao Hashizume, Sôsuke Ikematsu, Satomi Kobayashi, Taiyô Yoshizawa","A pesar de haber empezado una prometedora carrera de escritor, Ryota va de desilusión en desilusión. Se ha divorciado de Kyoko y gasta todo el dinero que gana como detective privado apostando en las carreras, por lo que finalmente no puede pagar la pensión alimentaria de su hijo de 11 años, Shingo. Ahora Ryota intenta ganarse nuevamente la confianza de sus seres queridos y formar parte de la vida de su hijo. La situación no parece fácil, pero un día un tifón obliga a toda la familia a pasar una noche juntos… (FILMAFFINITY)",https://www.filmaffinity.com/es/film968604.html
Conexión Marsella,La French (The Connection),2014,135,"Thriller, Drama",Francia,"6,6",2.593,Cédric Jimenez,"Jean Dujardin, Gilles Lellouche, Céline Sallette, Benoît Magimel, Guillaume Gouix, Bruno Todeschini, Féodor Atkine, Moussa Maaskri","1975. Pierre Michel es un joven magistrado que acaba de ser trasladado a Marsella para colaborar en la lucha contra el crimen organizado. Se trata de desactivar la French Connection, una operación de la mafia que exporta heroína a todo el mundo. Sin escuchar las advertencias, Pierre lidera una cruzada contra Gaëtan Zampa, el padrino más intocable. Pero pronto va a entender que para obtener resultados, deberá cambiar sus métodos. (FILMAFFINITY)",https://www.filmaffinity.com/es/film755691.html
Blue Jay,Blue Jay,2016,85,"Drama, Romance",Estados Unidos,"6,6",3.066,Alexandre Lehmann,"Mark Duplass, Sarah Paulson, Clu Gulager, Cindy Greer, Ana Iovine, Bill Greer, James Andrews","Jim y Amanda se encuentran por casualidad en su pueblo natal de Crestline en California después de veinte años sin verse. Él está allí porque su madre ha fallecido y tiene que poner su casa a la venta; ella está visitando a su hermana porque está embarazada. Los dos tienen muchas cosas que contar así que deciden ir a una cafetería para ponerse al día. A pesar de haber seguido caminos distintos, vuelven a conectar como si nada hubiera cambiado. Cuando llegan a la que fue la casa de Jim, la ex pareja se ve transportada al pasado y a los increíbles momentos que vivieron juntos. (FILMAFFINITY)",https://www.filmaffinity.com/es/film715279.html
Una mujer fantástica,Una mujer fantástica,2017,104,Drama,Chile,"6,6",7.143,Sebastián Lelio,"Daniela Vega, Francisco Reyes, Luis Gnecco, Aline Küppenheim, Amparo Noguera, Alejandro Goic, Antonia Zegers","Marina (Daniela Vega) una joven camarera aspirante a cantante y Orlando (Francisco Reyes), veinte años mayor, planean un futuro juntos. Tras una noche de fiesta, Marina lo lleva a urgencias, pero él muere al llegar al hospital. Ella debe entonces enfrentar las sospechas por su muerte. Su condición de mujer transexual supone para la familia de Orlando una completa aberración. Ella tendrá que luchar para convertirse en lo que es: una mujer fuerte, pasional... fantástica. (FILMAFFINITY)",https://www.filmaffinity.com/es/film750940.html
