Título,Título Original,Año,Duración,Género,País,Puntuación Media,Número de Puntuaciones,Director,Reparto,Sinopsis,Enlace
El espía inglés,The Courier,2020,111,"Intriga, Drama",Reino Unido,"6,4",4.559,Dominic Cooke,"Benedict Cumberbatch, Rachel Brosnahan, Jessie Buckley, Merab Ninidze, Angus Wright, Kirill Pirogov, Elina Alminas, Joseph Balderrama","Durante la Guerra Fría entre Estados Unidos y Rusia, el ingeniero Greville Wynne (Benedict Cumberbatch) se infiltra como espía en el MI6, servicio de inteligencia británico. Cuando la crisis de los misiles cubanos promete inclinar la balanza a favor del país soviético, Wynne comenzará a trabajar con la CIA para filtrar información sobre el plan que tienen en marcha los rusos y así evitar una catástrofe.",https://www.filmaffinity.com/es/film402922.html
Al filo de los diecisiete,The Edge of Seventeen,2016,102,"Comedia, Drama",Estados Unidos,"6,4",4.940,Kelly Fremon,"Hailee Steinfeld, Woody Harrelson, Kyra Sedgwick, Blake Jenner, Haley Lu Richardson, Laine MacNeil, Katie Stuart, Nesta Cooper",Dos estudiantes de instituto que son las mejores amigas ven cómo su amistad se tambalea cuando una comienza a salir con el hermano mayor de la otra. (FILMAFFINITY),https://www.filmaffinity.com/es/film967675.html
The King,The King,2019,133,"Aventuras, Drama",Australia,"6,4",9.980,David Michôd,"Timothée Chalamet, Joel Edgerton, Sean Harris, Robert Pattinson, Ben Mendelsohn, Lily-Rose Depp, Dean-Charles Chapman, Thomasin McKenzie","Hal (Timotheé Chamalet), un príncipe caprichoso y sin interés por ejercer su derecho al trono de Inglaterra, ha abandonado las responsabilidades reales para vivir en libertad entre la plebe. Sin embargo, ante la muerte de su tirano padre, Hal se ve obligado a retomar la vida de la que quería huir para ser el nuevo rey: Enrique V. Después de su coronación, el joven monarca tendrá que aprender a lidiar con las intrigas palaciegas, una guerra y los lazos que le unen a su antigua vida, como la relación con su mejor amigo y mentor, el caballero John Falstaff (Joel Edgerton).",https://www.filmaffinity.com/es/film361727.html
Joven y bonita,Jeune et jolie (Young & Beautiful),2013,94,Drama,Francia,"6,4",10.441,François Ozon,"Marine Vacth, Geraldine Pailhas, Frédéric Pierrot, Charlotte Rampling, Johan Leysen, Fantin Ravat, Nathalie Richard, Laurent Delbecque","Isabelle, una hermosa joven de 17 años que pertenece a una familia de clase alta de París, parece tener el mundo a sus pies. Pero tras un verano en el que la pérdida de la virginidad le resulta decepcionante, un viaje de autodescubrimiento sexual la embarcará a partir del otoño en una doble vida: estudiante de día y prostituta de lujo por las tardes. Esta es su historia, a través de cuatro estaciones y cuatro canciones. (FILMAFFINITY)",https://www.filmaffinity.com/es/film258921.html
Irrational Man,Irrational Man,2015,96,"Drama, Intriga, Comedia",Estados Unidos,"6,4",22.840,Woody Allen,"Joaquin Phoenix, Emma Stone, Jamie Blackley, Parker Posey, Ethan Phillips, Julie Ann Dawson, Mark Burzenski, Gary Wilmes","Abe Lucas, un profesor de filosofía en plena crisis existencial, llega a una nueva universidad. Allí se relaciona con dos mujeres: Rita Richards, una solitaria profesora que busca que la rescate de su infeliz matrimonio; y Jill Pollard, su mejor estudiante y muy pronto su amiga. Aunque Jill está enamorada de su novio, encuentra irresistible la personalidad atormentada de Abe. (FILMAFFINITY)",https://www.filmaffinity.com/es/film220234.html
John Wick: Pacto de sangre,John Wick: Chapter Two,2017,122,"Acción, Thriller",Estados Unidos,"6,4",24.651,Chad Stahelski,"Keanu Reeves, Riccardo Scamarcio, Bridget Moynahan, Ruby Rose, Peter Stormare, Ian McShane, Common, Alex Ziwak","El legendario asesino John Wick (Keanu Reeves) se ve obligado a salir del retiro por un exasociado que planea obtener el control de un misterioso grupo internacional de asesinos. Obligado a ayudarlo por un juramento de sangre, John emprende un viaje a Roma lleno de adrenalina estremecedora para pelear contra los asesinos más peligrosos del mundo. (FILMAFFINITY)",https://www.filmaffinity.com/es/film981917.html
Enemy,Enemy,2013,91,"Intriga, Drama",Canadá,"6,4",26.971,Denis Villeneuve,"Jake Gyllenhaal, Mélanie Laurent, Sarah Gadon, Isabella Rossellini, Joshua Peace, Tim Post, Kedar Brown, Darryl Dinn","Adam (Gyllenhaal) es un afable profesor de historia que lleva una vida bastante monótona. Un día, viendo una película, descubre a un actor que es idéntico a él. Obsesionado con la idea de tener un doble, la búsqueda de ese hombre tendrá para él consecuencias inesperadas... Libre adaptación de la novela ""El hombre duplicado"", de José Saramago. (FILMAFFINITY)",https://www.filmaffinity.com/es/film617900.html
The Treatment,De behandeling,2014,131,"Thriller, Intriga",Bélgica,"6,4",1.044,Hans Herbots,"Geert Van Rampelberg, Ina Geerts, Johan van Assche, Laura Verlinden, Ingrid De Vos, Brit Van Hoof, Dominique Van Malder, Tibo Vandenborre, Michael Vergauwen","El inspector Nick Cafmeyer parece tenerlo todo: buena presencia, inteligencia, perspectiva en su carrera… Sin embargo, una oscura sombra se cierne sobre su vida y sus relaciones. Desde los nueve años, Nick ha estado traumatizado por la desaparición sin resolver de su hermano menor, Bjorn. Basándose en el testimonio de Nick, su vecino Plettinckx, un conocido delincuente sexual, fue interrogado y puesto en libertad. Tras estos años, Plettinckx todavía vive cerca de Nick y uno de sus pasatiempos es acosarle. La única mujer capaz de sostener una relación intermitente con Nick, es su jefa, Danni, quien se resiste a incluir a Nick en un caso muy preocupante: una pareja ha estado tres días en cautiverio bajo el yugo de un intruso. Y este ha desaparecido sin dejar rastro junto al hijo de la familia, de nueve años. (FILMAFFINITY)",https://www.filmaffinity.com/es/film534818.html
"Kenshin, el guerrero samurái: El principio",Rurôni Kenshin: Sai shûshô - The Beginning,2021,137,"Acción, Drama, Romance",Japón,"6,4",1.159,Keishi Ōtomo,"Takeru Satō, Kasumi Arimura, Issey Takahashi, Yôsuke Eguchi, Kazuki Kitamura, Nijiro Murakami, Masanobu Ando, Towa Araki","Antes de convertirse en protector, Kenshin era un temible asesino conocido como Battosai. Pero su historia comienza a cambiar cuando conoce a la dulce Tomoe Yukishiro. (FILMAFFINITY)",https://www.filmaffinity.com/es/film560515.html
La pequeña muerte,The Little Death,2014,96,"Comedia, Drama",Australia,"6,4",1.261,Josh Lawson,"Bojana Novakovic, Damon Herriman, Kate Box, Kate Mulvany, Patrick Brammall, Alan Dukes, Lisa McCune, T.J. Power","Comedia sobre el sexo, el amor, las relaciones y los tabúes en una narración de varias historias. (FILMAFFINITY)",https://www.filmaffinity.com/es/film751312.html
Dating Amber,Dating Amber,2020,92,"Drama, Comedia",Irlanda,"6,4",1.573,David Freyne,"Fionn O'Shea, Lola Petticrew, Sharon Horgan, Barry Ward, Simone Kirby, Evan O'Connor, Ian O'Reilly, Emma Willis",Los mejores amigos Eddie (O'Shea) y Amber (Petticrew) fingen ser pareja para alejar los rumores sobre su orientación sexual que corren por el instituto.,https://www.filmaffinity.com/es/film766252.html
Rosalie Blum,Rosalie Blum,2015,91,Comedia,Francia,"6,4",1.690,Julien Rappeneau,"Noémie Lvovsky, Kyan Khojandi, Alice Isaaz, Anémone, Philippe Rebbot, Sara Giraudeau, Camille Rutherford, Nicolas Bridet","La vida del treintañero Vicente Machot transcurre entre su peluquería, su primo, su gato y su dominante madre. Un día, Vicente conoce por azar a Rosalie Blum, una misteriosa y solitaria mujer, y está convencido de sufrir un déja-vu, de que ya se ha encontrado con ella alguna vez. Intrigado, decide seguirla a todas partes, con la esperanza de saber más de ella. No sospecha que esto le llevará a una aventura llena de sorpresas, donde descubrirá personajes tan fantásticos como entrañables. (FILMAFFINITY)",https://www.filmaffinity.com/es/film954055.html
El imperio de las sombras,Mil-jeong,2016,139,"Thriller, Drama, Acción",Corea del Sur,"6,4",1.817,Kim Jee-woon,"Song Kang-ho, Gong Yoo, Han Ji-min, Eom Tae-gu, Park Hee-soon, Lee Byung-hun, Shingo Tsurumi, Foster Burden","Finales de los años 20, durante la ocupación japonesa de Corea. Un grupo de la resistencia intenta traer explosivos desde Shanghái para destruir la base nipona en Seúl, mientras que los japoneses intentan detenerlos. Un talentoso policía japonés nacido coreano, que había pertenecido al movimiento independiente, se ve en el dilema de elegir entre su deber y el apoyo a una causa mayor. (FILMAFFINITY)",https://www.filmaffinity.com/es/film529365.html
Mil veces buenas noches,"Tusen ganger god natt (A Thousand Times Goodnight) (1,000 Times Good Night)",2013,117,Drama,Noruega,"6,4",2.424,Erik Poppe,"Juliette Binoche, Nikolaj Coster-Waldau, Maria Doyle Kennedy, Larry Mullen Jr., Lauryn Canny, Adrianna Cramer Curtis, Mads Ousdal","Rebecca es una gran reportera de guerra. Tras un grave accidente, su marido e hijos le dan un ultimátum; o ellos o su trabajo. (FILMAFFINITY)",https://www.filmaffinity.com/es/film842109.html
Monos,Monos,2019,102,Drama,Colombia,"6,4",3.078,Alejandro Landes,"Moises Arias, Julianne Nicholson, Sofia Buenaventura, Jorge Román, Laura Castrillón, Sneider Castro","En la cima de una imponente montaña, donde lo que a primera vista parece un campamento de verano, ocho muchachos guerrilleros apodados “Los Monos» conviven bajo la estricta instrucción de un sargento paramilitar. Su única misión es la de cuidar a ""la doctora"" (Julianne Nicholson), una mujer norteamericana a la que han tomado como rehén. Cuando esta misión empieza a peligrar, la confianza entre ellos empezará a ser cuestionada. (FILMAFFINITY)",https://www.filmaffinity.com/es/film232725.html
Lejos de los hombres,Loin des hommes (Far From Men),2014,101,"Aventuras, Drama",Francia,"6,4",3.266,David Oelhoffen,"Viggo Mortensen, Reda Kateb, Djemel Barek, Vincent Martin, Nicolas Giraud, Jean-Jérôme Esposito, Hatim Sadiki, Yann Goven","Argelia, 1954. En medio del duro invierno, Daru (Viggo Mortensen), un profesor francés, acepta de mala gana escoltar a Mohamed (Reda Kateb), un hombre acusado de asesinato, a través de las montañas Atlas para que se enfrente a juicio. Perseguidos por hombres que reclaman la ley de la sangre y por colonos revanchistas, los dos hombres se rebelan. Juntos lucharán para recuperar la libertad. (FILMAFFINITY)",https://www.filmaffinity.com/es/film646969.html
Eddie el Águila,Eddie the Eagle,2016,101,"Comedia, Drama",Reino Unido,"6,4",3.875,Dexter Fletcher,"Taron Egerton, Hugh Jackman, Christopher Walken, Jim Broadbent, Matthew Brandon, Ania Sowinski, Mads Sjøgård Pettersen, Marc Benjamin","La película detalla las inspiradoras hazañas de Michael Edwards, más conocido como “Eddie el Águila”, el más famoso saltador de esquí en la historia británica. (FILMAFFINITY)",https://www.filmaffinity.com/es/film403387.html
"Trash, ladrones de esperanza",Trash,2014,115,"Aventuras, Drama, Thriller",Reino Unido,"6,4",6.036,Stephen Daldry,"Rickson Tevez, Eduardo Luis, Gabriel Weinstein, Rooney Mara, Martin Sheen, Wagner Moura, Selton Mello, André Ramiro","Dos niños de las favelas de Río de Janeiro encuentran una cartera en el vertedero donde buscan a diario, pero no se imaginan que este descubrimiento podría cambiar sus vidas. Cuando la policía local aparece para ofrecerles una generosa recompensa por la cartera, los dos chicos, Rafael y Gardo, comprenden que han encontrado algo importante. Deciden recurrir a su amigo Rata y los tres se lanzan a una extraordinaria aventura para intentar quedarse con la cartera y descubrir el secreto que esconde. (FILMAFFINITY)",https://www.filmaffinity.com/es/film597196.html
El nuevo Nuevo Testamento,Le Tout Nouveau Testament,2015,113,"Fantástico, Comedia",Bélgica,"6,4",6.328,Jaco Van Dormael,"Pili Groyne, Benoît Poelvoorde, Marco Lorenzini, Yolande Moreau, Catherine Deneuve, Laura Verlinden, François Damiens, Serge Larivière","¿Qué pasaría si Dios existiese y viviese en Bruselas? Dios en la Tierra es un cobarde, tiene patéticos códigos morales y su conducta con su familia es odiosa. Su hija Ea, que se aburre mortalmente en la anodina Bruselas, decide rebelarse contra su padre, entra en su ordenador y desvela a todo el mundo el día d su fallecimiento, con lo que hace que de repente todas las personas reflexionen sobre qué hacer con los días, meses, o años que les quedan por vivir. (FILMAFFINITY)",https://www.filmaffinity.com/es/film124755.html
Elle,Elle,2016,130,"Thriller, Drama",Francia,"6,4",18.766,Paul Verhoeven,"Isabelle Huppert, Laurent Lafitte, Anne Consigny, Charles Berling, Virginie Efira, Judith Magre, Christian Berkel, Jonas Bloquet","Michèle, exitosa ejecutiva de una empresa de videojuegos, busca venganza tras ser violada por un desconocido en su propia casa.",https://www.filmaffinity.com/es/film765960.html
El rey león,The Lion King,2019,118,"Animación, Aventuras, Drama, Musical",Estados Unidos,"6,4",21.255,Jon Favreau,"Donald Glover, Seth Rogen, Chiwetel Ejiofor, Alfre Woodard, Billy Eichner, John Kani, John Oliver, Beyoncé","Tras el asesinato de su padre, un joven león abandona su reino para descubrir el auténtico significado de la responsabilidad y de la valentía. Remake de ""El Rey León"", dirigido y producido por Jon Favreau, responsable de la puesta al día, con el mismo formato, de ""El libro de la selva"" (2016). (FILMAFFINITY)",https://www.filmaffinity.com/es/film316246.html
Marshall,Marshall,2017,118,Drama,Estados Unidos,"6,4",1.357,Reginald Hudlin,"Chadwick Boseman, Josh Gad, Kate Hudson, Dan Stevens, James Cromwell, Sterling K. Brown, Jussie Smollett, Rozonda 'Chilli' Thomas","Este drama histórico presenta los inicios de la carrera del abogado de la NAACP Thurgood Marshall (Chadwick Boseman), que se convertirá en el primer juez afroamericano de la Corte Suprema de Estados Unidos. En el Connecticut de 1940, Marshall defiende a un chófer negro (Sterling K. Brown) que es acusado de violar e intentar asesinar a su jefa blanca (Kate Hudson). (FILMAFFINITY)",https://www.filmaffinity.com/es/film865128.html
Nido de víboras,Beasts That Cling to the Straw,2020,108,Thriller,Corea del Sur,"6,4",1.579,Kim Yong-hoon,"Jeon Do-yeon, Jung Woo-sung, Kim Jun-han, Jeong Man-shik, Bae Sung Woo, Jung Ga-ram, Shin Hyun-bin, Jin Kyung","El destino de un mediocre grupo de desgraciados comienza a converger lentamente mientras se desmorona. Joong Man va tirando a duras penas trabajando en una sauna y cuidando de su madre enferma, hasta que encuentra en el vestuario una bolsa llena de dinero. Tae Young se ha metido en un lío porque su novia se ha dado a la fuga con el dinero que él le había robado a un prestamista. Además, aparece misteriosamente un cadáver. Mi Ran, acorralada entre su marido maltratador y su vulgar trabajo de camarera, empieza una relación con su joven amante, Jin Tae, quien se ofrece a matar a su pareja… Así empieza este juego en el que solo puede sobrevivir el más fuerte. (FILMAFFINITY)",https://www.filmaffinity.com/es/film308092.html
Nunca es demasiado tarde,Still Life,2013,92,"Drama, Comedia",Reino Unido,"6,4",1.816,Uberto Pasolini,"Eddie Marsan, Joanne Froggatt, Karen Drury, Andrew Buchan, Neil D'Souza, David Shaw Parker, Michael Elkin, Tim Potter","Diligente y trabajador, el solitiario John May es un empleado del ayuntamiento encargado de encontrar a los parientes más cercanos de las personas que acaban de morir. (FILMAFFINITY)",https://www.filmaffinity.com/es/film337216.html
Diplomacia,Diplomatie,2014,80,Drama,Francia,"6,4",2.161,Volker Schlöndorff,"André Dussollier, Niels Arestrup, Robert Stadlober, Paula Beer, Burghart Klaußner, Charlie Nelson, Jean-Marc Roulot","París, agosto 1944. El cónsul sueco Raoul Nordling (Dussollier) irrumpe en el hotel Meurice  para hablar con Dietrich von Choltitz (Arestrup), gobernador militar alemán de París durante los últimos días del dominio alemán en la capital francesa. La misión del cónsul consiste en convencer al general para que no ejecute la orden de activar los explosivos que harían volar los principales monumentos de la capital francesa: el Louvre, Nôtre-Dame y la Torre Eiffel, entre otros monumentos. Se trata de impedir que ""arda París"", como ha ordenado Hitler. (FILMAFFINITY)",https://www.filmaffinity.com/es/film618751.html
Wonder Women y el profesor Marston,Professor Marston & the Wonder Women,2017,108,Drama,Estados Unidos,"6,4",2.666,Angela Robinson,"Luke Evans, Rebecca Hall, Bella Heathcote, Connie Britton, JJ Feild, Maggie Castle, Oliver Platt, Christopher Paul Richards","Basada en la vida del Dr. William Marston, psicólogo y teórico de Harvard, quien ayudó a crear el detector de mentiras y el famoso personaje ficticio de la Mujer Maravilla. Esta película muestra parte de la relación poco convencional que compartió con dos mujeres: su esposa Elizabeth (Rebecca Hall), y Olive Byrne, una alumna de William que invita a la pareja a una hermandad femenina, en donde exploran y comparten ideas sobre sexualidad y sumisión. A partir de este evento, William, Elizabeth y Olive forman un triángulo tanto amoroso como intelectual: la química entre los tres fue la clave para crear a la famosa heroína y dotarla de sus propios ideales feministas. Luchando contra aquellos que intentaron censurar la historieta por considerarla violenta y llena de perversión, el trío defendió firmemente la presencia de un personaje femenino que sirviera de inspiración para las mujeres de todo el mundo. (FILMAFFINITY)",https://www.filmaffinity.com/es/film151633.html
Grandma,Grandma,2015,79,"Comedia, Drama",Estados Unidos,"6,4",2.875,Paul Weitz,"Lily Tomlin, Julia Garner, Marcia Gay Harden, Judy Greer, Laverne Cox, Sam Elliott, Elizabeth Peña, Nat Wolff","Elle acaba de romper con su novia Olive, cuando su nieta Sage aparece inesperadamente pidiéndole dinero con urgencia. Aún dolida por su ruptura sentimental, la abuela Elle y Sage pasarán todo el día intentando conseguir dinero visitando a antiguos amigos, lo que hará que comiencen a desvelarse secretos del pasado. (FILMAFFINITY)",https://www.filmaffinity.com/es/film479586.html
BAC Nord: Brigada de Investigación Criminal,BAC Nord,2021,105,Thriller,Francia,"6,4",2.897,Cédric Jimenez,"Gilles Lellouche, François Civil, Karim Leklou, Adèle Exarchopoulos, Kenza Fortas, Idir Azougli, Cyril Lecomte, Michael Abiteboul","Año 2012. Los distritos del norte de Marsella ostentan un triste récord: son el área con la tasa de criminalidad más alta de Francia. Tres agentes del BAC Nord, una brigada anticrimen que trabaja sobre el terreno, buscan infructuosamente mejorar sus resultados. En un sector de alto riesgo, la policía adapta sus métodos, a veces cruzando difusas líneas rojas. (FILMAFFINITY)",https://www.filmaffinity.com/es/film442290.html
El Cairo confidencial,The Nile Hilton Incident,2017,106,Thriller,Suecia,"6,4",4.351,Tarik Saleh,"Fares Fares, Tareq Abdalla, Yasser Ali Maher, Nael Ali, Hania Amar, Slimane Dazi, Ger Duany, Ahmed Abdelhamid Hefny","Noureddine, un detective corrupto con un futuro brillante en el cuerpo de policía, y cuyo principal propósito no es exactamente hacer el bien sino hacerse rico, es enviado al hotel Nile Hilton, donde acaban de descubrir el cadáver de una hermosa mujer. La identidad de ésta, sus conexiones con las élites de El Cairo y otros incidentes más personales acabarán llevando a Noureddine a tomar decisiones trascendentales y a descubrirse a sí mismo. (FILMAFFINITY)",https://www.filmaffinity.com/es/film480073.html
Al final del túnel,Al final del túnel,2016,120,"Thriller, Intriga",Argentina,"6,4",7.628,Rodrigo Grande,"Leonardo Sbaraglia, Clara Lago, Pablo Echarri, Federico Luppi, Javier Godino, Walter Donado, Uma Salduende, Daniel Morales Comini","Joaquín está en silla de ruedas. Su casa, que conoció tiempos mejores, ahora es lúgubre y oscura. Berta, bailarina de striptease, y su hija Betty, llaman a su puerta respondiendo a un anuncio que puso Joaquín para alquilar una habitación. Su presencia alegra la casa y anima la vida de Joaquín. Una noche, mientras trabaja en su sótano, Joaquín escucha un ruido casi imperceptible. Se da cuenta entonces que una banda de delincuentes está construyendo un túnel que pasa bajo su casa con la intención de robar un banco cercano. (FILMAFFINITY)",https://www.filmaffinity.com/es/film705602.html
El regalo,The Gift,2015,108,"Intriga, Thriller, Drama",Estados Unidos,"6,4",19.411,Joel Edgerton,"Rebecca Hall, Jason Bateman, Joel Edgerton, Beau Knapp, Allison Tolman, David Denman, P.J. Byrne, Tim Griffin","La vida de Simon y Robyn, una joven pareja que acaba de mudarse a una nueva casa en California, comienza a verse incómodamente alterada cuando empiezan a recibir misteriosos regalos de un antiguo compañero de clase de Simon. (FILMAFFINITY)",https://www.filmaffinity.com/es/film424979.html
Predestination,Predestination,2014,97,"Ciencia ficción, Thriller, Intriga",Australia,"6,4",19.641,"Michael Spierig, Peter Spierig, The Spierig Brothers","Ethan Hawke, Sarah Snook, Noah Taylor, Elise Jansen, Freya Stafford, Christopher Kirby, Alexis Fernandez, Cate Wolfe","Un agente especial (Ethan Hawke) de un departamento secreto del gobierno, una agencia creada en los años 80 que permite realizar viajes en el tiempo, tendrá que realizar una compleja serie de ""saltos"" hacia atrás en el tiempo con el fin de detener al conocido como ""el terrorista fallido"" (The Fizzle Bomber), un individuo que está poniendo bombas por todo el país con miles de víctimas. En uno de sus viajes a los 70, el agente, que trabaja encubierto como camarero de un bar, conoce a un hombre que le narra una historia extraordinaria... (FILMAFFINITY)",https://www.filmaffinity.com/es/film758826.html
Bailando por la vida,Cha Cha Real Smooth,2022,107,"Drama, Comedia",Estados Unidos,"6,4",1.026,Cooper Raiff,"Cooper Raiff, Dakota Johnson, Leslie Mann, Odeya Rush, Brad Garrett, Raúl Castillo, Phil Nardozzi, Colton Osorio","A Andrew, un joven de 22 años recién salido de la universidad que no sabe qué hacer con su vida, no le queda más remedio que volver con su familia a Nueva Jersey. Todo un experto en montar un buen sarao, consigue un trabajo de animador en las fiestas de bar mitzva de los compañeros de clase de su hermano pequeño. Cuando se hace amigo de una mujer llamada Domino y su hija Lola, que tiene un ligero autismo, Andrew descubre el futuro que desea realmente... aunque puede que no sea el suyo.",https://www.filmaffinity.com/es/film278511.html
Per el afortunado,Lykke-Per,2018,162,Drama,Dinamarca,"6,4",1.027,Bille August,"Esben Smed Jensen, Katrine Greis-Rosenthal, Benjamin Kitter, Julie Christiansen, Tommy Kenter, Tammi Ost, Rasmus Bjerg, Ole Lemmeke","En su búsqueda de la felicidad, Per se muda lejos de la oscura región de Jutland y de su familia extremadamente religiosa, sobre todo huyendo de su padre, un cura. Se embarca hacia Copenhague​ para convertirse en ingeniero y comenzar un gran proyecto energético. En la gran ciudad, Per descubre su apetito por la vida y la felicidad, envolviéndose en un despreocupado y vívido entorno social.",https://www.filmaffinity.com/es/film534862.html
La mafia sólo mata en verano,La mafia uccide solo d’estate (The Mafia Only Kills in Summer),2013,90,"Comedia, Drama",Italia,"6,4",1.032,Pierfrancesco Diliberto,"Alex Bisconti, Pierfrancesco Diliberto, Cristiana Capotondi, Ginevra Antona, Rosario Lisma, Claudio Gioè, Ninni Bruschetta, Barbara Tabita","Palermo, 1969. Arturo es concebido mientras en esa misma calle un grupo de mafiosos lleva a cabo una de las matanzas más sangrientas de la Cosa Nostra. A partir de ese momento, la vida de Arturo se cruzará con la de mafiosos, policías y jueces en una especie de ""Forrest Gump a la siciliana"". (FILMAFFINITY)",https://www.filmaffinity.com/es/film210620.html
La ceniza es el blanco más puro,Jiang hu er nv,2018,135,Drama,China,"6,4",1.273,Jia Zhangke,"Zhao Tao, Liao Fan, Xu Zheng, Casper Liang, Feng Xiaogang, Diao Yinan","En 2001, la joven Qiao está enamorada de Bin, cabecilla de la mafia local de Datong. Cuando Bin es atacado por una pandilla rival, Qiao se defiende y dispara varias veces. Es condenada a cinco años de cárcel. Tras cumplir su pena, Qiao busca a Bin e intenta volver con él. Pero él no quiere seguirla. Diez años más tarde, en Datong, Qiao sigue soltera y ha salido adelante manteniéndose fiel a los valores de la mafia. Pero Bin, cansado de la vida, regresa buscándola, a la única persona a la que ha amado...",https://www.filmaffinity.com/es/film121431.html
Una gran mujer (Beanpole),Dylda,2019,137,Drama,Rusia,"6,4",1.343,Kantemir Balagov,"Viktoria Miroshnichenko, Vasilisa Perelygina, Konstantin Balakirev, Andrey Bykov, Olga Dragunova, Timofey Glazkov","Leningrado, 1945. La Segunda Guerra Mundial ha devastado la ciudad y derruido sus edificios, dejando a sus ciudadanos en la miseria tanto a nivel físico como psíquico. El asedio, uno de los peores de la Historia, ha terminado, pero la vida y la muerte continúan combatiendo en el desastre que la guerra deja tras de sí. Dos mujeres jóvenes, Iya y Masha, tratan de encontrar un sentido a sus vidas para reunir fuerzas de cara a reconstruir la ciudad. (FILMAFFINITY)",https://www.filmaffinity.com/es/film636414.html
